review_id,order_detail_id,user_id,product_id,review_content,review_date,review_rate
1036,1036,4040,105,"4일날 코랄 제 꺼 받구 거의 바로 남편꺼 시켰는데
어제 받고 이제 뜯어봤네용 ㅎㅎ 검은색도 너무 예뻐용 ㅠㅠ
컬러별로 진짜 소장 각입니다 ㅜㅜ 울 작가님 최고👍",2021-02-18,50
1037,1037,4041,105,"크림색 샀는데 옆에서 엄마가 보더니 
너무 예쁘다고 극찬을 하십니다...
",2021-02-18,50
1038,1038,4042,105,예뻐요 잘받았습니다!,2021-02-18,50
1039,1039,4043,105,너무 잘 쓰고 있어요! 그립톡에 금색 테두리가 있어서 더 고급지네요😊 다음에 또 다른 색상으로 재구매 하고싶어요!,2021-02-15,50
1040,1040,4044,105,"다른색으로 믹스해서 조금 걱정했는대 아주 잘어울립니다
기스났다고 먼저 연락하고 하나 더 보내주셔서 감사했어요
각인부분 디자인 먼저 공유되면 더 좋을 것 같아여
붙일때 좀 가운데 붙였더니 불편해서 조금 위에다 붙일려고하니까 다시 안떨어질 정도로 접착력갑이네여
친구듀 선물해줬는데 금장 깔끔하고 맘에든다고 좋아하네여
케이스만 추가 구매 할 수 있으면 좋겠어요
s10 케이스 윗 아래 커버는 없어서 떨어뜨릴때 조심해야겠네오",2021-02-14,50
1041,1041,4045,105,이뻐요 재구매 할거에여 ㅎㅎ,2021-02-11,50
1042,1042,4046,105,색도 원하눈 색으로 너무 예쁘게 잘 빠졌고 디자인도 너무 예뻐요ㅠ,2021-02-11,50
1043,1043,4047,105,너무 이뻐요^^,2021-02-11,50
1044,1044,4048,105,"진짜 너무 예뻐요~!!
다들 진짜예쁘다고 부럽부럽 
노란색이나 보라둘중 한개 더
주문하려고 고민중이예요!!!♡
",2021-02-11,50
1045,1045,4049,105,"진짜.. 너무 존예네요
사진이랑 색 똑같고 그립톡도 튼튼한 것 같아요
작가님 요청사항 너무 잘 들어주시고..
적게 일하고 많이 버세요 ㅜㅜ♡",2021-02-10,50
1046,1046,4050,106,"기대 이상입니다~
너무 이뻐요
아쉬운건 카드 넣고 빼는 부분이 힘듭니다 그러나 이뻐서 패스~하트도 추가해서 더 나아요
블랙색상도 하고 싶네요~
",2021-02-18,40
1047,1047,4051,106,케이스 색상이 생각한 것 보다 조금 어두웠으나 충분히 예쁩니다. 스트랩은 손이 편하게 들어가고 안정성도 좋아요👍👍👍다만 버튼 누르는게 조금 빡세네요😅,2021-02-17,45
1048,1048,4052,106,"진자 ,, 넘 넘 옙버여 ,, 예상했던것보다도 예뻐서 지금 자랑하고 다니고 있서욥,, 넘 감삼댜 ..❤️❤️",2021-02-17,50
1049,1049,4053,106,"터프케이스로 하니 튼튼해보여요 생각보다 너무 투박하지않고요
다만 뒤에 체인은.. 괜히한것같아요 삼성페이가 어렵네요;",2021-02-17,50
1050,1050,4054,106,"너무이쁩니다ㅋㅋ 
대각선으로 할껄ㅜ
잘못생각했네요ㅋㅋ 
그래도 맘에들어요ㅋ 착용감이나그립감도괜찮고ㅋ
아.. 렌즈커버가.. 21울트라로... ㅋㅋㅋ 제가잘못보고주문해버렸네요ㅜ 슬픔ㅜㅜㅜ
3000원버렸네유ㅜ 카툭튀때문에 산거였는데ㅠ... 아쉽네용ㅋㅋ 써보질못해서ㅋ 렌즈커버는 .. 후기가없어요ㅋ 
케이스는 대 만족!!!!!!!!!!",2021-02-17,50
1051,1051,4055,106,너무 예뻐요,2021-02-17,50
1052,1052,4056,106,최고에요 친구가 너무 좋아해요,2021-02-17,50
1053,1053,4057,106,정말 예뻐요. 다른 색도 또 사고 싶네요. Good!!!,2021-02-12,50
1054,1054,4058,106,"이뻐요~흔하지 않은 디자인이라 더욱 맘에 들어요~
스트랩에 적응하려면 시간이 좀 필요하겠어요 ㅎㅎ 스트랩이 포인트인데 달그락 거리는 소리와 부피감 정도는 감당해야할 것 같네요. 핸드폰을 어디에 두어도 제 꺼인줄 다 알아보니 저 같이 물건 잘 두고 다니는 사람에겐 따악 ㅋㅋ
예쁘고 개성있는 케이스 정말 감사해요~잘 쓸게요^^",2021-02-11,50
1055,1055,4059,106,너무 이뻐요~^^,2021-02-09,50
1056,1056,4060,107,"라벤더 애쉬랑 옐로우 구매했습니다, 후기가 너무 없지만 다들 좋아서 고민하다가 구매했는데요, 실리콘 재질도 부드럽고, 지문 안 남아서 너무 좋네요. 라벤더 애쉬는 사진보다 밝은 것 같고, 옐로우는 노란색+하얀색 섞인 레몬크림색이에요. 마감 너무 좋아서 깜짝 놀랐어요. 다만 이건 생각지도 못했는데 케이스가 각지다보니 폰이 좀 커보이고 그립감도 케이스 얇은거 쓰시던 분이면 어색할 수 있겠다는 생각이 드네요. 잘 쓸게요!",2021-02-18,50
1057,1057,4061,107,완전 맘에 들어요! 가볍고 이쁩니당>< 저두 때타면 나중에 하나 더 사려구요~ 감사합니다!ㅎㅎ,2021-02-18,50
1058,1058,4062,107,"깔끔하니 이쁘고 그립감도 좋고 부드러워요
튼튼해보이고 여러모로 맘에 들어서 다른색도 구매하고 싶어요 다음에 또 살 생각입니다
중간에 색깔 바꿨는데두 친절하게 바꿔주셔서 감사해영❤️",2021-02-18,50
1059,1059,4063,107,"배송도 빠르고 만족합니다~
뒷편에 살짝 찍힌 부분이 있지만 쓰다보면 어차피 스크레치 생기기때문에 그냥 쓰려구용",2021-02-18,45
1060,1060,4064,107,심플 이즈 베스트 아닙니까. 너무 마음에 들어요😎👍,2021-02-18,50
1061,1061,4065,107,아이폰 11 퍼플이라서 색이 좀 질렸었는데 흰색  산 것 같고 너무너무 예뻐용!!!!!냄새 조금 나는데 머리 아픈 정도는 아니고 조금 뻑뻑해요!!사이드가 화면보다 튀어나오지 않아서 그런지 폰 뒤집어서 놓으면 강화유리가 닿아서 미끄러지긴 하는데용 그래도 예쁩니다..🌹🌺🌷🌺❤️,2021-02-18,50
1062,1062,4066,107,배송도 정말 빨리오고 색깔도 너무 깔끔하니 예뻐요 핸드폰도 가볍네요^^,2021-02-16,50
1063,1063,4067,107,고민하고 있다면 바로 주문하셔도 될거같습니다!!! 엄청 기대하고 설 전에 주문했다가 설 끝나서 배송 올 때까지 거의 매일 들어가서 후기 볼만큼 기대했는데 실물이 기대 이상이에용 손에 착 감기고 지문도 잘 안남구 퀄리티 대박 좋아요ㅠㅠㅠ 색상도 사진이랑 비슷하고 카메라부분이나 다른 부분도 잘 맞아요! 저는 더 구매하려구요 첫 구매라 좋아하는 노래 제목 새겼는데 너무 마음에 들어용☺️ 감사합니다 복 많이 받으세요 작가님!!,2021-02-16,50
1064,1064,4068,107,너무 잘 맞고 예쁩니다. 특히 카메라 렌즈 부분이 잘 보호되어져서 좋습니다. 오랜만에 좋은 케이스를 발견했네요. 색감도 너무 이뻐요!!,2021-02-16,50
1065,1065,4069,107,색상도 이쁘고 마감처리도 잘되어있어욤,2021-02-14,50
1066,1066,4070,108,화면에 보이는 그대로에요. 특별하고 예뻐요.,2021-02-18,50
1067,1067,4071,108,"남친이 어떤 컬러 좋아할지 몰라서
화이트 블랙 두가지로 주문했는데 잘한거같아요~
시안도 배송도 다 빨라서 너무 감사했습니다 ^^
받는사람이 엄청 좋아하니까 기분이 좋네요 ㅎㅎ
잘 쓸게요~ 번창하세요!!",2021-02-16,50
1068,1068,4072,108,"진짜 너어어어엉어무 이뻐요
남친이랑 둘 다 만족했습니다^^
케이스는 투명이 더 이뿐거 같고
에어팟 케이스가 대박입니다....ㅎㅎ",2021-02-16,50
1069,1069,4073,108,너무 이뻐요❤️❤️심플하고 가벼워요 범퍼로 할까 고민했는데 투명으로 하길 잘한거 같아요!!이쁘게 해주셔서 감사합니당❤️,2021-02-16,50
1070,1070,4074,108,시안도 꼼꼼하게 봐주시고 케이스도 너무 예뻐요~ ,2021-02-15,50
1071,1071,4075,108,가격대비 괜찮아요~,2021-02-15,50
1072,1072,4076,108,그냥 투명 케이스보단 디자인이 조금 있는걸 하고싶었는데 유니크하면서도 튀지않아 딱 제가 원하던거예요! 케이스 사이즈도 잘맞습니다. ,2021-02-15,50
1073,1073,4077,108,너무 이뻐요~~~♡♡♡,2021-02-15,50
1074,1074,4078,108,,2021-02-15,50
1075,1075,4079,108,"보여주신 시안 그대로 왔고 너무 예뻐요! 아직 글씨가 떼지는지는 확인 못했지만, 만약 그렇게 된다면 다시 주문할게요!",2021-02-13,50
1076,1076,4080,109,"너무 맘에들어요^^ 수정요청도 잘 들어주시고 응대도 빠르고 친절하셨어요 ㅎㅎ 실물로 받아보니 사진으로 본거보다 훨 이쁘고 만족스러웠어요😋 무엇보다 , 생각한것 보다 훨씬 훨씬 더 이뻣어요!!!다음에도 꼭 다시 구매할거예요🤩🤩",2021-02-18,50
1077,1077,4081,109,"진짜 너무 이뻐요 ㅠㅠㅠㅠ 감사합니다!!!
다음에 또 구매할거에요! 
매번 기념일이나 바꿀때 되면 여기서 할거에요 ㅠㅠ
감사합니다❤️❤️❤️❤️",2021-02-18,50
1078,1078,4082,109,"3개  주문해서 한개는 선물줬는데 너무 좋아했어요^^
그림수정 했는데도 친절하게 답변 및 수정 해주셔서
감사합니다~
이쁜사진 찍으면 또 주문해야겠어요~~",2021-02-18,50
1079,1079,4083,109,"너무 예뻐요!! 잘 받았습니다💜💜💜
연휴에 주문을 해서 오래 걸릴줄 알았는데 생각보다 빠르게 받았어요!! 내일이 기념일인데 딱 오늘 도착했어요ㅠㅠ 감사합니다 잘 쓸게요💜💜💜💜",2021-02-18,50
1080,1080,4084,109,"케이스 잘받았습니다~!!

수정요청에도 흔쾌히 수정해 주시고 질문에 메세지도 바로 주셔서 넘 감사했어요.
명절이 끼어있어서 조금 기다렸는데 예쁘게 제작해 주셔서 감사해요!

결혼기념일 선물로 딸램까지 셋이 맞추었는데 넘넘 좋아합니다~^^

담에 또 주문할게요~^^",2021-02-18,50
1081,1081,4085,109,"너무 예뻐요 ㅎㅎㅎㅎ
남자친구가 좋아해서 저도 기분이 좋네용
케이스 바꿀때되면 다른 사진으로 또 할게요!!!",2021-02-18,50
1082,1082,4086,109,"작가분한테 사소한 요청도 많이 했는데 진짜 너무 예뻐요 ㅠㅠㅠㅠ 
예쁘게 만들어주셔서 감사합니다 ㅠㅠ",2021-02-18,50
1083,1083,4087,109,"남자친구랑 커플케이스하고 싶어서 했는데 너무너무 맘에 들어요~!! 남자친구도 엄청 좋아해서 제가 다 뿌듯하네요ㅎㅎ 
정말 감사합니다 ^-^",2021-02-18,50
1084,1084,4088,109,사장님 진짜 너무 예뻐요 사진에 다 못담아서 너무 아쉬울 뿐입니다ㅠㅠ진짜 이거 아까워서 조심조심 쓰다가 다시 주문할거에여❤❤중간에 수정사항도 너무 친절하게 받아주셔서 감사합니다👍👍,2021-02-18,50
1085,1085,4089,109,너무 예쁜 폰케이스 잘 받았어요!! 투명 젤리케이스라 안쪽에 투명 드로잉 스티커를 붙여 더 꾸며줬네요 ㅎㅎ 완전 대만족 엄청 예뻐요 ㅠㅠ,2021-02-18,50
1086,1086,4090,110,"넘 예빠여ㅠㅠ
포장도 너무 정성스럽게 하신 게 느껴집니다
아이디어스 첫 구매인데 넘 만족스라으ㅜ여 
감사합니당",2021-02-18,50
1087,1087,4091,110,"실물이훨씬이쁘네요 ㅎㅎ
제이름으로 문구넣으니 더욱더 귀여운듯 ㅎㅎ
갤20핑크는 후기가없는거같아 이렇게올립니다
꽃이 튼튼히잘붙어있음좋겠네용",2021-02-18,50
1088,1088,4092,110,"예쁘고 귀엽고 플립에 너무 찰떡이에요 😭
다만 사이즈가 좀 안맞는지 펼쳤을때 미세하게 덜 펴져서 
한번 더 펴줘야해요!! 
잘 쓰겠습니당~~ ",2021-02-18,50
1089,1089,4093,110,설연휴도 있고 하여 배송은 엄청 오래 걸렸지만 맘에 들어요~ 하드케이스는 처음이라 그런지 부러질까 염려되더라고요~ 끼면 빼기가 쉽지 않지만 잘 안빠져야 딱 맞는거겠죠~ 넘 이쁘고 맘에 들어요 ^^ 잘 사용할게요~,2021-02-16,50
1090,1090,4094,110,"정말 귀여워요~지금까지 구매했더 케이스 중 가장 만족합니다!!!
블랙으로 했고요. 제트플립 케이스가 많이 없었는데 이렇게 맘에 쏙 드는 케이스 구매할 수 있어 좋구요. 이름까지 넣을 수 있어 더 특별해요
잘 사용할께요~감사합니다^^
사은품도 넘 잘받았습니다~",2021-02-16,50
1091,1091,4095,110,"생각했던대로 아기자기하고 너무 예쁩니다❤️
서비스라 쓰고 뇌물이라 읽는 에어팟 케이스도 잘 쓸게요 ㅋㅋㅋㅋ
많이 파세요!😃",2021-02-16,50
1092,1092,4096,110,디자인도 너무 귀엽고 다 좋은데 그립톡이 자꾸 떨어지네요 딱 3일째 쓰고 있는날에 떨어지더라고요.. 제 것만 그러는건지 ..ㅠㅠ,2021-02-14,40
1093,1093,4097,110,"이뻐용 아들태명으로 문구 넣었어요ㅎㅎ 귀엽네용ㅋㅋ
담에 더 이쁜작품으로 뵈요ㅎㅎ",2021-02-09,50
1094,1094,4098,110,"방금 받았는데, 진짜 생각했던 것보다 더 퀄리티 젛아용>< 
핸드폰이 길다보니 걱정이 많았는데, 전혀 그런 생각 안들어용~
너무 맘에들고, 이쁘게 사용하겠습니다💗",2021-02-09,50
1095,1095,4099,110,"생각했던것만큼 너무 귀여워요💜ㅠ요청했던부분도 이뿌게왔어요! 작가님 뇌물(?)도 잘받았구요><ㅎㅎㅎ고민하시는분들 그럴필요없습니당 어여주문하세요@,,@",2021-02-09,50
1096,1096,4100,111,"보라색 장미로 샀는데 예뻐옇ㅎ
",2021-02-18,50
1097,1097,4101,111,"친구들이랑 같이 맞췄는데 너무너무 예뻐요~
명절이랑 주말도 낀데다가 주문제작이라 좀 걸리겠지...싶었는데 주말에 시안을 보내주시고 주문한지 일주일정도 걸려서 온 것 같네요 기본 포장도 예쁘고 정말 기다린 보람이 있는 것 같네요!🥰🥰🥰",2021-02-18,50
1098,1098,4102,111,케이스 진짜 이뻐용 배송두 빠르구 글귀도 추가안했다가 넘 허전해 보여서 문의해서 추가했는데 추가하길 잘한거같아요! 너무너무 만족해요!!,2021-02-17,50
1099,1099,4103,111,"커플로 블랙&화이트로 맞췄는데 너무예뻐요♡
탄생확랑 줄기에이름까지 은은하게 뜻도 있고 디자인도 심플하니 예뻐서 너무 마음에 들어요 잘쓰겠습니다~",2021-02-17,50
1100,1100,4104,111,"핸드폰이 검은색이였는데 검은색 글씨로 샀어오...나란 사람 바보.,, 근데 무난하니 예쁘고 심플하고 좋습니다",2021-02-17,50
1101,1101,4105,111,"노트20이고 하드, 미색, 은방울꽃으로 했어요
진짜 귀엽고 이뻐요!

다음에 다시 산다면 색 맞추게 연보라색으로 사보고싶네요:)",2021-02-16,50
1102,1102,4106,111,"생각했던 것보다 훨씬 예뻐요
커스텀이라 시안까지 받아봤었는데 시안도 정말 빨리 보내주시고 답변도 정말 빨라서 감사했습니다
케이스 컬러도 컬러차트보다 더 예뻐서 놀랐어요
헐렁하지도 않고 꼭 잘 맞아서 좋습니다
예쁘게 만들어주셔서 감사해요
질리면 다른것도 주문할생각이에요
",2021-02-15,50
1103,1103,4107,111,휴대전화 변경해서 재구매했어요 무광블랙이 고급스럽고 디자인도 너무 예뻐요 너무너무 마음에 들어요,2021-02-15,50
1104,1104,4108,111,"연휴에 주문해서 배송이 오래걸릴거라 생각했는데
월요일에 바로와서 놀랬어요!
제 생일의 탄생화가 없어서 따로 시안 의뢰드렸는데 너무 맘에들게 예쁘게 나왔어요
범퍼케이스만 쓰다가 하드 처음 써봐서 어색하지만
손에 감기는게 좋네요 ㅎㅎ
색감도 너무예쁘구 대만족입니ㄷㅏ!!!!!",2021-02-15,50
1105,1105,4109,111,어머니 생신 선물로 구매했는데 크기가 큰 핸드폰에 추가를 딱히 안 하니 너무 허전하더라고요ㅠㅠㅠ 그래도 예쁘게 포장까지 잘 받았습니다!,2021-02-11,45
1106,1106,4110,112,너무 이쁘네요. 작가님 감사합니다.,2021-02-17,50
1107,1107,4111,112,실물이 훨이쁘고 만족스러워요 담에 또 주문하려구요 많이 파세요~!!!!!,2021-02-17,50
1108,1108,4112,112,너무 이뻐요 ㅠㅠ 기다린 보람 있어요 이쁜 상품 만들어주셔서 너무 감사합니다~!!(˃̶᷄‧̫ ˂̶᷅๑ ),2021-02-16,50
1109,1109,4113,112,"너무 친절하시게 시안도 잘 고쳐주셨고
연휴전에 받아볼수있게  빨리보내주셔서 너무너무 감사합니다~",2021-02-12,50
1110,1110,4114,112,"남자친구랑 커플로 맞췄는데 마음에 들어요🤍
케이스가 조금 빡빡하긴 해요.",2021-02-10,50
1111,1111,4115,112,"이뻐요 특이해요
조금 아쉬운데 한자 크기가 컸으면 더 좋았을뻔!
그래도 남친 선물해줬는데 너무 좋아하더라구요!
",2021-02-10,50
1112,1112,4116,112,,2021-02-09,50
1113,1113,4117,112,"마음에 들어요 ! 
범퍼라 좀 무겁긴 하지만
색도 이쁘고 문구도 이쁘게 됐어요~
오래 쓸것 같네요 !",2021-02-09,50
1114,1114,4118,112,폰이 커서 어울릴까 했는데 여태 본 케이스중에 제일 만족스럽고 이쁘네요 ㅎㅎ ,2021-02-09,50
1115,1115,4119,112,"지금도 만족하며 바라보지요!만족합니다.
친절한 배송까지, 감사합니다.
새해 복 많이 받으세요!^^",2021-02-08,50
1116,1116,4120,113,"너무 예뻐요ㅠㅠ 강추강추
색도 예쁘게 조합되어있네요!!
이니셜도 적을 수 있어서 좋습니다
키링 달면 더 예뻐질것같아요~",2021-02-18,50
1117,1117,4121,113,오로라 유광 실물 짱,2021-02-18,50
1118,1118,4122,113,"굉장히 예뻐요! 키링사둔거랑 잘어울리는거 같아용
친구들이 다 케이스 이쁘다고 어디서샀냐구 물어보기도 했어요! 케이스 감사합니당❤❤",2021-02-18,50
1119,1119,4123,113,"와이프 선물로 에어팟 케이스랑 폰 케이스 구매했는데
둘다 너무 이쁘고 맘에 들어하네요",2021-02-18,40
1120,1120,4124,113,제가 디자인을 실수로 잘못 택하였지만 이것도 충분히 예뻐서 유용하게 잘 사용하고 다닐 거 같습니다 감사합니다,2021-02-18,45
1121,1121,4125,113,너무 귀엽네요 ㅜㅜ 다른 색깔 사러 또 올게요~!!!,2021-02-17,50
1122,1122,4126,113,남자친구 선물로 줬는데 완전 맘에 들어요!! 제껏도 사려고 들어와보니 후기를 안썼길래 이제야 쓰네요ㅠㅠ 최고예요❤️,2021-02-17,50
1123,1123,4127,113,"퀄은 정말 좋아요 어디가서 이런 퀄리티의 케이스는 못 얻을 것 같습니다 다음 번에도 다른 색상으로 재구매할 생각 있습니다 하지만 처음에 양면테이프가 오지 않아서 작가님이 다시 발송해주셨고, 그 후에 따로 붙이고 뚜껑을 씌웠는데 자꾸 틈이 생기네요 ,,, 앞뒤 바꿔가며 해봐도 똑같아요 ㅠㅠ 다른 후기는 틈이 보이지 않던데 제껀 왜그럴까요?? 너무 속상하네요 ... ",2021-02-17,40
1124,1124,4128,113,예뻐요...! 그리고 케이스 착용 방법과 빼는 방법이 적힌 종이도 주셔서 넘 좋아요❤️ 잘 쓸게요🥰,2021-02-16,50
1125,1125,4129,113,예뻐요 예뻐요 설연휴 지나고 바로 받았어요 깔끔하고 이뻐요,2021-02-15,50
1126,1126,4130,114,하트모양에는 좀더 멀리서찍은 사진을 넣을걸그랬지만 그래도 예쁘게 잘 왔어요 감사합니다,2021-02-18,50
1127,1127,4131,114,"가격은 같은데 실수해서 주문을 잘못했는데도 잘 보내주셨어요!
사진도 잘릴까봐 걱정했는데 엄청 고퀄리티에 예쁘게 잘 나와서 너무너무 좋아요! 🙂🙂🙂 완전 대대대대만족이에요!",2021-02-17,50
1128,1128,4132,114,사진이랑 완전 똑같아요 사진도 선명하고 글도 이쁘고 잘쓰겟습니다,2021-02-17,50
1129,1129,4133,114,,2021-02-16,50
1130,1130,4134,114,소유템 짱 👍🏻,2021-02-16,50
1131,1131,4135,114,사진사이즈가 애매해서 잘나올까 했는데 작가님이 이쁘게 잘 맞춰서 제작해주셔서 완전 이쁘게 나왔어요. 남자친구 선물로 차키키링로 이용중이에요. 짱이뻐요,2021-02-16,50
1132,1132,4136,114,"남편 생일선물로 
버즈 프로 사면서 케이스랑 키링까지 주문제작했어요!
코발트 블루색 너무 이뻐요 ㅠㅠ색감 미쳤음💙
문구도 원하는대로 깔끔하게 잘 나왔고 
키링에 전화번호랑 아이랑 강아지 사진 넣었는데
이쁘게 잘 편집해서 보내주셨어요
작가님 감사해요🥺💕",2021-02-16,50
1133,1133,4137,114,"친구 생일선물로 산건데 너무 이쁘고
친구도 마음에 들어해요 ㅎ",2021-02-15,50
1134,1134,4138,114,감사합니다:),2021-02-15,50
1135,1135,4139,114,버즈케이스나 휴대폰에걸어두니 너무 예뻐요~ 잘쓸께요!,2021-02-14,50
1136,1136,4140,115,생각보다 빠르고 넘 이쁘게 됐어요!! 대만족입니당ㅎㅎ,2021-02-18,50
1137,1137,4141,115,"조잡해보이네요
서로 맞지를  않고
그림 디자인은 잘 나오고 좋은데",2021-02-18,25
1138,1138,4142,115,그림 수정요청도 딱 마음에 들게 수정해주시고 결과물이 원하는대로 나와서 너무 만족해요☺️☺️ 선물로 준비한건데 마음에 드네요 감사합니다!,2021-02-18,50
1139,1139,4143,115,이전에 프로랑 2세대 주문했어요. 여자친구가 너무 마음에 들어해서 에어팟프로를 선물하는 김에 똑같이 다시 만들었어요! 너무 잘 만들어 주섰어요ㅎㅎ 다음에 또 주문하러 올게요! 감사합니다.,2021-02-18,50
1140,1140,4144,115,"구매한지 꽤 됬는데 ㅠㅠㅠ 늦은 후기 올려요 ㅠㅠㅠ
너무이뻐요💕 남자친구도 엄청 좋아하구 맘에들어하더라구여 
예전에 케이스도 맞췄었는데 역시 작가님 늘친절해서 좋아요 ㅎㅎㅎ다음에도 이용할께여",2021-02-17,50
1141,1141,4145,115,"남자친구랑 커플로 맞췄어요!
시안도 빠르게 받고, 이쁘게 그려주셔서 매우 만족스러워요~!",2021-02-17,50
1142,1142,4146,115,남자친구랑 곧 100일이서 기념으로 에어팟케이스 주문제작했는데 너무 마음에 들어요 감사합니다,2021-02-17,50
1143,1143,4147,115,설 연휴가 있었는데도 친절하게 설명해주시고 배송도 빠르게 보내주셔서 너무 좋았어요! 수정사항도 잘 들어주셔서 이쁘게 잘 쓰겠습니당!!:),2021-02-17,50
1144,1144,4148,115,시안 봤을 때도 폰스트랩 디테일까지 살려주신거보구ㅜㅠ기대했는데 실물로 보니까 너무 이뻐요ㅠ남친 군대에 있어서 얼른 전달해주고싶어요ㅠ짱짱 이쁩니다 체고♡,2021-02-17,50
1145,1145,4149,115,"시안도 빨리 보내주시고 친절하십니다!
여자친구도 안끼려고 할까봐 좀 걱정했는데 이쁘다고 잘 끼고 다니네욤 ㅎㅎ",2021-02-17,50
1146,1146,4150,116,"실물 깔끔하고 예뻐요!!
에어팟이랑 잘어울리고 넘 만족스럽습니다💚",2021-02-18,50
1147,1147,4151,116,진짜 예쁘고 케이스 쉽게 떨어질까봐 걱정했는데 착 붙어서 좋아요!!!,2021-02-17,50
1148,1148,4152,116,시안 확인 후에 바로 이틀정도 걸려서 바로 상품 받았고 사진이랑 똑같았어요 너무 이쁘고 잘 쓰겠습니다 다음에 또 살 일이 있으면 또 여기로 올거에오!,2021-02-17,50
1149,1149,4153,116,"혹시 별로면 어쩌지 걱정했는데 정말 예뻐요!!!
에어팟프로 케이스도 버즈프로 케이스도 정말 딱맞고 엄청 예쁩니다!!!",2021-02-16,50
1150,1150,4154,116,너무 이뻐요!! 반투명 과연 괜찮을까 고민 많이 했는데 생각보다 더 좋아요 친구 생일 선물로 산 건데 친구도 완전 좋아해서 만족스러워요ㅎㅎ 설 끝나고 16일에 제작한다고 해서 많이 늦을 거라고 생각했는데 엄청 빨리 도착해서 놀랐어요 너무 감사해요♡♡ 보라색도 너무 예쁘고 좋네용 그리고 제가 질문을 많이 했는데 답변 친절하게 해주셔서 너무 감사드려요!! 담에는 제 것도 사보려구요~~!! 번창하세요🥰❣,2021-02-15,50
1151,1151,4155,116,남자친구가 에어팟프로 구매한 기념으로 선물해줬는데 너무 맘에 들어했어요~ 노래도 저희 커플 애증의 노래라 이걸로 선택했더니 도안도 예상대로 너무 잘 뽑아주셔서 너무 만족했네요ㅠㅠ 도안 수정할 때도 의견을 엄청 잘 반영해주셔서 예쁜 케이스가 나올 수 있었던 거 같습니다😊 작가님 감사합니다♥︎,2021-02-15,50
1152,1152,4156,116,,2021-02-14,50
1153,1153,4157,116,,2021-02-13,50
1154,1154,4158,116,"버즈 라이브 케이스 찾는 중에 눈에 딱 들어온 제품이었어요!! 좋아하는 가수의 노래를 넣을 수 있다니ㅠㅠ 작가님 아이디어 최고에요..
후기 보고 제 버즈컬러에는 바탕글씨 흰색이 잘 보일 것 같아서 요청드렸고 완전 만족스럽게 작업해주셨어요.

예쁜키링 아직 달지 못했지만 볼때마다 뿌듯하네요~ 
같은 팬덤인 친구도 마음에 들어해서 선물하려고 해요. 예쁘게 만들어주셔서 고맙습니다.

**근데 이거 뺄 때 어떻게 빼죠?;;",2021-02-12,50
1155,1155,4159,116,"넘흐 예뻐용
제일 좋아하는 노랜데 
버즈에 품고 다닐 생각하니까
겁나 신납니다 ^.^",2021-02-11,50
1156,1156,4160,117,"실제로 보니 더더 너무 예쁘고 만족스러워요!!! 
표면 재질이나 마감등 품질면에서도 완벽해요
도안 정할때도 친절히 말씀해주셔서 넘 좋았어요ㅎㅎ
남자친구가 정말 좋아하네요 감사드립니다:)",2021-02-18,50
